{"schema":"testing-design.generate-request.v1","repository":{"url":"https://example.invalid/acme/web.git","target_commit":"1111111111111111111111111111111111111111","worktree":{"kind":"approved-worktree","ref":"workspace://acme-web/1111111111111111111111111111111111111111"}},"analysis":{"repository_analysis":{"schema":"testing-design.artifact-reference.v1","artifact_schema":"testing-design.repository-analysis.v1","artifact_pointer":".testing/runs/design/repository-analysis.v1.json","artifact_digest":"aaaaaaaaaaaaaaaaaaaaaaaaaaaaaaaaaaaaaaaaaaaaaaaaaaaaaaaaaaaaaaaa"},"requirements_index":{"schema":"testing-design.artifact-reference.v1","artifact_schema":"testing-design.requirements-index.v1","artifact_pointer":".testing/runs/design/requirements-index.v1.json","artifact_digest":"bbbbbbbbbbbbbbbbbbbbbbbbbbbbbbbbbbbbbbbbbbbbbbbbbbbbbbbbbbbbbbbb"},"traceability_seed":{"schema":"testing-design.artifact-reference.v1","artifact_schema":"testing-design.traceability-seed.v1","artifact_pointer":".testing/runs/design/traceability-seed.v1.json","artifact_digest":"cccccccccccccccccccccccccccccccccccccccccccccccccccccccccccccccc"}},"existing_test_inventory":{"schema":"testing-design.artifact-reference.v1","artifact_schema":"testing-design.existing-test-inventory.v1","artifact_pointer":".testing/runs/design/existing-test-inventory.v1.json","artifact_digest":"dddddddddddddddddddddddddddddddddddddddddddddddddddddddddddddddd"},"allowed_catalogs":{"actions":{"catalog_id":"testing-design.browser-actions","catalog_version":"1.0.0","catalog_digest":"eeeeeeeeeeeeeeeeeeeeeeeeeeeeeeeeeeeeeeeeeeeeeeeeeeeeeeeeeeeeeeee"},"assertions":{"catalog_id":"testing-design.browser-assertions","catalog_version":"1.0.0","catalog_digest":"ffffffffffffffffffffffffffffffffffffffffffffffffffffffffffffffff"}},"prompt_template":{"template_id":"testing-design.browser-smoke","template_version":"1.0.0","template_digest":"0000000000000000000000000000000000000000000000000000000000000000"},"policy":{"policy_id":"testing-design.generation-policy.v1","max_candidates":1,"max_steps_per_candidate":1,"max_prompt_bytes":4096,"max_response_bytes":4096,"timeout_ms":30000},"artifact_root":".testing/runs/design/generation","trace_id":"trace-browser-title","dedup_key":"generate-browser-title"}
